Id_Fornecedor;Razão_Social;Endereço;Telefone;Pedidos
1200;RAILOU MJ E-COMMERCE;SÃO PAULO, SP, BR;11986649575;Alfabeto Preto E Branco
1300;Hadassa e Betina Publicidade e Propaganda ME;Rua Oito, RJ, BR;1127142713;Berloque GLOBO PASSAPORTE AVIÃO em 100% Prata
1400;Diogo e Giovanni Joalheria ME;Rua Pernambuco, MG, BR;1325912165;Berloque Prata 925 - Lagartingo
1500;Laura e Débora Adega Ltda;Rua Santo Amaro 134, BA, BR;1335591710;Berloque Pingente Casal
1600;Priscila e Isadora Transportes ME ;Rua Buri, SP, BR;1136650322;Berloques com Cristais
